{
  "format": "medfluen-lecture",
  "version": 1,
  "packageId": "n4-epilepsi-kurateret-2026-v1",
  "lecture": {
    "moduleId": "K5 Nervesystem og psykiatri",
    "lectureId": "N4",
    "title": "Epilepsi"
  },
  "sources": [
    {
      "id": "n4-pdf",
      "filename": "N4 - Epilepsi.pdf",
      "pageCount": 59
    }
  ],
  "sections": [
    {
      "id": "grundlag",
      "title": "Grundbegreber, epidemiologi og ætiologi",
      "summary": "Afgrænsning af epileptiske anfald og epilepsi, sygdommens hyppighed samt årsager og anfaldsudløsende faktorer.",
      "order": 1
    },
    {
      "id": "anfaldstyper",
      "title": "Anfaldstyper og klinisk semiologi",
      "summary": "Fokale og generaliserede anfald, bevidsthedspåvirkning, fokal udbredelse og postiktale udfald.",
      "order": 2
    },
    {
      "id": "syndromer",
      "title": "Epilepsisyndromer",
      "summary": "Syndromklassifikation og karakteristika ved juvenil myoklon epilepsi og mesial temporallapssklerose.",
      "order": 3
    },
    {
      "id": "udredning",
      "title": "Udredning, EEG og billeddiagnostik",
      "summary": "Anamnese og undersøgelser efter første anfald, EEG-fortolkning og undersøgelsens begrænsninger samt strukturel billeddiagnostik.",
      "order": 4
    },
    {
      "id": "differentialdiagnoser",
      "title": "Differentialdiagnoser til epileptiske anfald",
      "summary": "Synkope, PNES og andre årsager til anfaldslignende episoder. Kliniske observationer og video-EEG i differentialdiagnostikken.",
      "order": 5
    },
    {
      "id": "behandling",
      "title": "Behandlingsprincipper og behandlingsmuligheder",
      "summary": "Afvejning efter første anfald, individualiseret præparatvalg og ikke-medikamentel behandling, herunder kirurgi og neurostimulation.",
      "order": 6
    },
    {
      "id": "status",
      "title": "Status epilepticus: genkendelse og akut håndtering",
      "summary": "Behandlingsgrænser, konvulsiv og non-konvulsiv status, udløsende årsager, diagnostik og overordnede akutte behandlingsprincipper.",
      "order": 7
    },
    {
      "id": "prognose-raad",
      "title": "Prognose, livsstil og sikkerhed",
      "summary": "Dødelighed, anfaldsudløsende forhold og praktiske sikkerhedsforanstaltninger ved epilepsi.",
      "order": 8
    }
  ],
  "glossary": [
    {
      "id": "epileptisk-anfald",
      "term": "Epileptisk anfald",
      "definition": "Et epileptisk anfald er en kortvarig episode, hvor abnorm elektrisk aktivitet i hjernens neuroner giver symptomer. Hvilke symptomer der opstår, afhænger af de involverede netværk. Det kan være bevægelser, ændrede sanseoplevelser, autonome symptomer eller påvirket bevidsthed. Kramper er kun én mulig anfaldsform. Epilepsi betegner derimod sygdommen med vedvarende anfaldstilbøjelighed.",
      "sourceRefs": [
        {
          "sourceId": "n4-pdf",
          "page": 3
        },
        {
          "sourceId": "n4-pdf",
          "page": 4
        },
        {
          "sourceId": "n4-pdf",
          "page": 11
        }
      ],
      "sourceLinks": [
        {
          "title": "Epilepsi – Lægehåndbogen",
          "url": "https://www.sundhed.dk/sundhedsfaglig/laegehaandbogen/neurologi/tilstande-og-sygdomme/kramper/epilepsi/"
        }
      ]
    },
    {
      "id": "eeg",
      "term": "Elektroencefalografi (EEG)",
      "definition": "EEG registrerer elektriske aktivitetsmønstre i hjernen via elektroder, sædvanligvis på skalpen. Aktivitetens tidsforløb og fordeling kan støtte vurderingen af epilepsi og anfaldstype. Et normalt EEG mellem anfald udelukker ikke epilepsi: epileptisk aktivitet kan være fraværende under den korte optagelse. Gentagen registrering, søvnregistrering eller længere video-EEG kan øge muligheden for at finde relevante forandringer. EEG måler funktionel elektrisk aktivitet, ikke hjernens struktur som MR.",
      "sourceRefs": [
        {
          "sourceId": "n4-pdf",
          "page": 19
        },
        {
          "sourceId": "n4-pdf",
          "page": 23
        },
        {
          "sourceId": "n4-pdf",
          "page": 25
        },
        {
          "sourceId": "n4-pdf",
          "page": 26
        }
      ],
      "sourceLinks": [
        {
          "title": "Epilepsi – Lægehåndbogen",
          "url": "https://www.sundhed.dk/sundhedsfaglig/laegehaandbogen/neurologi/tilstande-og-sygdomme/kramper/epilepsi/"
        }
      ]
    },
    {
      "id": "pnes",
      "term": "Psykogene ikke-epileptiske anfald (PNES)",
      "definition": "PNES kaldes også funktionelle eller dissociative anfald. Episoderne kan ligne epileptiske anfald, men skyldes ikke epileptisk elektrisk anfaldsaktivitet. Symptomerne er reelle og ikke bevidst frembragte. Psykologiske og dissociative mekanismer kan være relevante, men man må ikke stille diagnosen alene ud fra et enkelt klinisk tegn. Video-EEG kan sammenholde symptomerne med den elektriske aktivitet; resultatet kræver faglig fortolkning. PNES og epilepsi kan forekomme samtidig. En forståelig diagnoseforklaring og relevant psykologisk eller psykiatrisk behandling er vigtige dele af håndteringen.",
      "sourceRefs": [
        {
          "sourceId": "n4-pdf",
          "page": 32
        },
        {
          "sourceId": "n4-pdf",
          "page": 33
        },
        {
          "sourceId": "n4-pdf",
          "page": 34
        }
      ],
      "sourceLinks": [
        {
          "title": "Dissociative lidelser – Lægehåndbogen",
          "url": "https://www.sundhed.dk/sundhedsfaglig/laegehaandbogen/psykiatri/tilstande-og-sygdomme/oevrige-sygdomme/dissociative-lidelser/"
        }
      ]
    },
    {
      "id": "status-epilepticus",
      "term": "Konvulsiv status epilepticus",
      "definition": "Konvulsiv status epilepticus er et vedvarende krampeanfald eller gentagne krampeanfald, hvor personen ikke genvinder sin normale bevidsthed imellem. Ved fem minutters vedvarende konvulsivt anfald skal akut behandling påbegyndes. Tilstanden kan være livstruende og kræver både anfaldskontrol, sikring af vejrtrækning og kredsløb samt udredning af årsagen. Den kan opstå uden tidligere kendt epilepsi. Den konvulsive femminuttersgrænse må ikke overføres ukritisk til alle former for non-konvulsiv status.",
      "sourceRefs": [
        {
          "sourceId": "n4-pdf",
          "page": 47
        },
        {
          "sourceId": "n4-pdf",
          "page": 49
        },
        {
          "sourceId": "n4-pdf",
          "page": 51
        },
        {
          "sourceId": "n4-pdf",
          "page": 54
        },
        {
          "sourceId": "n4-pdf",
          "page": 55
        }
      ],
      "sourceLinks": [
        {
          "title": "Status epilepticus – Lægehåndbogen",
          "url": "https://www.sundhed.dk/sundhedsfaglig/laegehaandbogen/neurologi/tilstande-og-sygdomme/kramper/status-epilepticus/"
        }
      ]
    },
    {
      "id": "todds-parese",
      "term": "Todds parese (postiktal parese)",
      "definition": "Todds parese er en forbigående kraftnedsættelse efter et epileptisk anfald. Typisk rammes den ene kropsside, men udfaldet kan også begrænses til ansigt, arm eller ben. Den svage side er som regel modsat anfaldets fokus i hjernen; fundet kan derfor hjælpe med at lokalisere udgangspunktet. Kraften vender tilbage, men varigheden varierer. En ny parese må ikke automatisk tilskrives anfaldet: apopleksi kan også debutere med kramper og skal vurderes akut. Mekanismen bag Todds parese er ikke fuldt afklaret.",
      "sourceRefs": [
        {
          "sourceId": "n4-pdf",
          "page": 12
        }
      ],
      "sourceLinks": [
        {
          "title": "Todds parese – Ugeskrift for Læger",
          "url": "https://ugeskriftet.dk/videnskab/todds-parese"
        }
      ]
    },
    {
      "id": "fokalt-anfald",
      "term": "Fokalt epileptisk anfald",
      "definition": "Et fokalt anfald begynder i neuronale netværk, der er begrænset til én hjernehalvdel. Symptomerne afspejler de områder, der aktiveres, og kan omfatte bevægelser, sanseoplevelser eller ændret bevidsthed. Bevidstheden kan være bevaret eller påvirket. Aktiviteten kan brede sig til begge hjernehalvdele og udvikle sig til et bilateralt tonisk-klonisk anfald. De første symptomer kan derfor være vigtigere for at lokalisere starten end de senere, mere udbredte kramper.",
      "sourceRefs": [
        {
          "sourceId": "n4-pdf",
          "page": 9
        },
        {
          "sourceId": "n4-pdf",
          "page": 10
        },
        {
          "sourceId": "n4-pdf",
          "page": 11
        }
      ],
      "sourceLinks": [
        {
          "title": "Focal onset seizure – ILAE EpilepsyDiagnosis.org",
          "url": "https://www.epilepsydiagnosis.org/seizure/focal-seizure-overview.html"
        }
      ]
    },
    {
      "id": "generaliseret-anfald",
      "term": "Generaliseret epileptisk anfald",
      "definition": "Et generaliseret anfald engagerer hurtigt netværk i begge hjernehalvdele. Det betyder ikke, at hele hjernebarken nødvendigvis er involveret. Gruppen omfatter flere anfaldstyper, blandt andet absencer, myoklonier og tonisk-kloniske anfald. Generaliseret beskriver organiseringen af anfaldsaktiviteten, ikke blot at bevægelser ses på begge kropssider. Et fokalt anfald kan også ende med bilaterale kramper.",
      "sourceRefs": [
        {
          "sourceId": "n4-pdf",
          "page": 9
        },
        {
          "sourceId": "n4-pdf",
          "page": 11
        },
        {
          "sourceId": "n4-pdf",
          "page": 13
        },
        {
          "sourceId": "n4-pdf",
          "page": 14
        }
      ],
      "sourceLinks": [
        {
          "title": "Generalized onset seizure – ILAE EpilepsyDiagnosis.org",
          "url": "https://www.epilepsydiagnosis.org/seizure/generalized-seizure-groupoverview"
        }
      ]
    },
    {
      "id": "automatismer",
      "term": "Automatismer",